{
  "schemaVersion": "1.1",
  "trustStoreId": "trust.landometer.release.2026-09-23.01",
  "controlledBy": "Landometer release operator",
  "scope": "package_release",
  "keys": [
    {
      "keyId": "landometer.release.2026-09-23.01",
      "issuerId": "landometer-release-operator",
      "algorithm": "Ed25519",
      "publicKeySpkiPem": "-----BEGIN PUBLIC KEY-----\nMCowBQYDK2VwAyEAB17C0u2izPd2yu/1L8EyLQxtG2PQYrna+81CWWRLJrM=\n-----END PUBLIC KEY-----\n",
      "allowedPurposes": [
        "release_approval",
        "asset_approval",
        "disclosure_authority",
        "claim_approval",
        "claim_evidence_capture",
        "agent_authority",
        "agent_revocation",
        "automated_conformance",
        "package_root"
      ],
      "validFrom": "2026-09-23T10:56:26+07:00",
      "validUntil": null,
      "revokedAt": null
    }
  ]
}
